<?xml version="1.0" encoding="UTF-8"?>
<xs:schema xmlns:xs="http://www.w3.org/2001/XMLSchema" attributeFormDefault="unqualified"
           elementFormDefault="qualified">
    <xs:element name="config" type="configType"/>
    <xs:complexType name="itemType" mixed="true">
        <xs:sequence>
            <xs:element type="itemType" name="item" maxOccurs="unbounded" minOccurs="0"/>
        </xs:sequence>
        <xs:attribute type="xs:string" name="name" use="optional"/>
        <xs:attribute type="xs:string" name="remove" use="optional"/>
    </xs:complexType>
    <xs:complexType name="mapType">
        <xs:sequence>
            <xs:element type="itemType" name="item" maxOccurs="unbounded" minOccurs="0"/>
        </xs:sequence>
        <xs:attribute type="xs:string" name="name" use="optional"/>
    </xs:complexType>
    <xs:complexType name="configType">
        <xs:sequence>
            <xs:element type="mapType" name="map" maxOccurs="unbounded" minOccurs="0"/>
        </xs:sequence>
    </xs:complexType>
</xs:schema>